{
  "$schema": "./schema.json",
  "color": {
    "deepSpace": {
      "value": "#0A0E1A",
      "type": "color",
      "description": "深空黑/浅空白基底"
    },
    "aetherPurple": {
      "value": "#7C3AED",
      "type": "color",
      "description": "神秘紫强调色"
    },
    "electricBlue": {
      "value": "#00D4FF",
      "type": "color",
      "description": "电光蓝交互色"
    },
    "liquidGlass": {
      "value": "#1C1C2E80",
      "type": "color",
      "description": "液态玻璃卡片基底（带 alpha）"
    },
    "nebulaGlow": {
      "value": "#FFE5B4",
      "type": "color",
      "description": "星云光晕高光"
    },
    "starlight": {
      "value": "#E5E7EB",
      "type": "color",
      "description": "星光白/夜色文字"
    },
    "duskGray": {
      "value": "#4B5563",
      "type": "color",
      "description": "暮色灰（系统色 fallback）"
    }
  },
  "gradient": {
    "aetherGradient": {
      "value": {
        "from": "aetherPurple",
        "to": "electricBlue",
        "direction": "topLeading-bottomTrailing"
      },
      "type": "gradient",
      "description": "品牌主渐变：紫 → 电光蓝"
    }
  },
  "typography": {
    "aetherTitle": {
      "value": {
        "size": 28,
        "weight": "semibold"
      },
      "type": "typography",
      "description": "Aether 标题"
    },
    "aetherDisplay": {
      "value": {
        "size": 48,
        "weight": "bold"
      },
      "type": "typography",
      "description": "Aether 展示字体（开屏 Logo / 大标题）"
    },
    "aetherBody": {
      "value": {
        "size": 16,
        "weight": "regular"
      },
      "type": "typography",
      "description": "Aether 正文"
    }
  },
  "cornerRadius": {
    "small": {
      "value": 12,
      "type": "cornerRadius",
      "description": "小圆角"
    },
    "medium": {
      "value": 16,
      "type": "cornerRadius",
      "description": "中圆角"
    },
    "large": {
      "value": 24,
      "type": "cornerRadius",
      "description": "大圆角"
    },
    "pill": {
      "value": 999,
      "type": "cornerRadius",
      "description": "胶囊圆角"
    }
  },
  "spacing": {
    "xs": {
      "value": 2,
      "type": "spacing",
      "description": "2pt"
    },
    "sm": {
      "value": 4,
      "type": "spacing",
      "description": "4pt"
    },
    "md": {
      "value": 8,
      "type": "spacing",
      "description": "8pt"
    },
    "lg": {
      "value": 12,
      "type": "spacing",
      "description": "12pt"
    },
    "xl": {
      "value": 16,
      "type": "spacing",
      "description": "16pt"
    },
    "xxl": {
      "value": 24,
      "type": "spacing",
      "description": "24pt"
    },
    "xxxl": {
      "value": 32,
      "type": "spacing",
      "description": "32pt"
    }
  },
  "animation": {
    "transition": {
      "value": 0.25,
      "type": "animation",
      "description": "页面转场 0.25s"
    },
    "messageAppear": {
      "value": 0.2,
      "type": "animation",
      "description": "消息进入 0.2s"
    },
    "buttonPress": {
      "value": 0.1,
      "type": "animation",
      "description": "按钮按下 0.1s"
    }
  },
  "material": {
    "ultraThin": {
      "value": "ultraThinMaterial",
      "type": "material",
      "platform": "apple",
      "description": "超薄材质（液态玻璃 AI 气泡）"
    },
    "regular": {
      "value": "regularMaterial",
      "type": "material",
      "platform": "apple",
      "description": "常规材质"
    }
  }
}
